Product/Service,Price Range,What's Included,Best For,ROI Timeline,Revenue Potential,Additional Costs to Consider,Competitive Advantages with Manus
Manus Quantum Metagloves,"$9,000 per pair",Pair of Quantum gloves; millimeter-accurate electromagnetic tracking; 2 batteries; USB-C cables; dongle; liner gloves; travel case; swappable 3-hour batteries,Film/VFX studios; high-end mocap; research requiring precision; animation requiring finger detail; professional production,6-12 months for production studios (vs keyframe animation time savings),$150-500/hr mocap services; $2k-10k/day performance capture; $50k-200k/film project,Tracking system ($5k-50k); workstation ($3k-8k); software licenses; maintenance; training,Drift-free tracking; millimeter accuracy; professional film/VFX quality; industry-leading precision
Manus Prime 3 Gloves,"$4,000-6,000 per pair (estimated)",Pair of Prime 3 gloves; flex sensor tracking (25 DOF); 10-hour battery; USB-C cables; dongle; batteries; mounting adapters; travel case,VR training; enterprise applications; game development; industrial design; robotics research; education,12-18 months for training applications (vs traditional training costs),$100-300/hr VR development; $40k-180k/training project; $15k-50k/experience,VR headset ($400-1500); tracking ($500-3k); workstation ($2k-5k); ongoing support,10-hour battery (industry-leading); easy calibration (45 sec); comfortable; wireless; versatile
Manus Prime 3 Haptic,"$5,000-7,000 per pair (estimated)",Prime 3 base features + haptic feedback actuators on all 5 fingers; vibrotactile feedback; prop interaction simulation,VR experiences requiring touch feedback; training simulations; robotics teleoperation; research on haptics; rehabilitation,8-15 months for specialized applications (increased engagement/retention),$150-400/hr haptic development; $50k-150k/specialized training; premium service rates,Same as Prime 3 + haptic content development; specialized training for haptic design,Full-finger haptics (unique); precise + tactile feedback; immersion advantage; research capability
Xsens Prime 3 by Manus,"$6,000-8,000 per pair (estimated)",Prime 3 gloves fully integrated with Xsens MVN system; Awinda adapters; Link adapters; synchronized timecode; combined data stream,Full-body mocap studios; film production; game animation; sports analysis; biomechanics research,6-12 months for animation studios (full-performance capture efficiency),$200-600/hr full-body mocap; $3k-15k/day studio rental; $100k-500k/film production,Xsens MVN system ($15k-50k+); workstation; storage for large mocap files; technical staff,Seamless integration; single unified workflow; time-synchronized data; professional ecosystem
Manus Core Software License (Annual),"$500-1,500/year",Core software; all free plugins (Unity/Unreal/MotionBuilder); recording; FBX/CSV export; basic technical support; updates,Small studios; indie developers; research labs; educational institutions; annual budget planning,Immediate for ongoing projects (enables billable work),Enables all service revenue; required for commercial work,Hardware costs; workstation; VR headset; tracking system,All plugins included; regular updates; multi-platform; proven enterprise support
Manus Core Software License (Perpetual),"$2,500-5,000 one-time",Same as annual but perpetual license; lifetime updates; priority support; no recurring fees,Established studios; long-term projects; organizations preferring capital expenditure; no recurring costs,18-24 months (vs annual licensing over time),Enables all service revenue; no annual fee impact on margins,Same as annual; larger upfront capital; budget planning,No vendor lock-in via subscriptions; predictable costs; asset value; budget flexibility
SDK Feature License,Contact sales (Feature license),SDK remote access; integrated mode (no Core needed); custom integration capability; advanced API access,Enterprise custom development; robotics companies; medical device firms; defense contractors; research institutions,Project-dependent (custom integration value),$100-500/hr integration consulting; $50k-200k/custom system; ongoing support contracts,Development time; integration consulting; custom hardware; ongoing maintenance,Full hardware control; custom integration; proprietary development; research freedom
Polygon Full-Body IK (Annual),"$2,000-5,000/year (estimated)",Full-body IK solver; 5-tracker setup; Unity/Unreal plugins; multi-user support; real-time streaming,Virtual production; collaborative VR; fitness/social VR; educational VR; quick-setup mocap,"12-24 months for collaboration/training (travel cost savings, productivity)",$150-400/hr virtual production; $5k-50k/collaboration project; $25k-100k/fitness app,VR trackers ($300-1000); headsets ($400-1500/user); networking infrastructure,No suit required; fast setup (45 sec); scalable; multi-user; accessible; cost-effective
Complete VR Training Setup,"$15,000-50,000",Gloves + HMD + tracking system + Core license + training content development + setup consulting,Corporate training departments; educational institutions; VR experience centers; simulation training,"12-36 months (training effectiveness, reduced accidents, faster onboarding)",$40k-180k/client (training development); recurring content updates; multi-department rollout,Space rental; staff training; content updates; technical support; replacement parts,Natural interaction (higher retention); realistic training; measurable outcomes; competitive edge
Complete Mocap Studio Setup,"$50,000-150,000+",Quantum/Prime 3 gloves + optical tracking (OptiTrack/Vicon) + Polygon + workstation + software suite + calibration,Professional animation studios; film/TV production; game development studios; research universities,"6-18 months for professional studios (project throughput, client acquisition)",$500-2500/session; $2k-10k/day; $50k-300k/project; asset sales; consulting,Studio space; multiple cameras; optical tracking; lighting; technical staff; insurance,Professional quality; high precision; compatible ecosystem; established workflows; client trust
Complete Robotics Teleoperation Setup,"$25,000-100,000+",Gloves + robotic hand + SDK license + ROS2 integration + custom teleoperation interface + training,Robotics labs; teleoperation research; automation companies; defense; space exploration; medical robotics,"24-36 months for research (grant funding, publications, breakthroughs)",$150-500/hr consulting; $50k-200k/system integration; research grants; publications,Robotic hardware ($10k-100k+); computing infrastructure; safety systems; technical expertise,Low latency; human-like control; research-proven; ROS2 native; imitation learning ready
Enterprise VR Development Package,"$40,000-180,000/project",Complete VR app development; custom hand interaction systems; training content; deployment; 6-month support,Enterprises rolling out VR training; automotive companies; aerospace; manufacturing; healthcare simulation,"Project-specific (training ROI, operational efficiency gains)",$40k-180k/project; $100-300/hr ongoing support; multi-year contracts; enterprise accounts,Project management; testing; deployment; training; documentation; ongoing support,Proven technology; established vendor; comprehensive support; scalable solution; future-proof
